id,message,message_preprocessed,category,length,category_bin
36,"Moreover, as I have argued, if you do accept these background views, then to be consistent you’d have to draw other conclusions that most New Atheist types would not want to draw. Again, if you accept a Humean critique of natural theology, then to be consistent you should also be skeptical about the claims of natural science and ethics to tell us anything about objective reality. And if you accept a Kantian critique of natural theology, then while you can consistently take natural science and ethics to have a rational basis, you cannot consistently treat theology with the contempt that Dawkins and Co. typically do. Hence the lessons so many have drawn from Hume’s and Kant’s critiques is not the one either of those critiques actually supports.",moreover argued accept background view consistent draw conclusion new atheist type would want draw accept humean critique natural theology consistent also skeptical claim natural science ethic tell u anything objective reality accept kantian critique natural theology consistently take natural science ethic rational basis consistently treat theology contempt dawkins co typically hence lesson many drawn critique one either critique actually support,,752,1
89,"How confident are you that a) your reading represents the view of the book, and b) that the papacy was uninterested as opposed to ill-informed or silent (per your expectations) for other reasons?",confident reading represents view book b papacy uninterested opposed ill-informed silent per expectation reason,,195,1
99," _and death caused by the Nazis and Soviets during WWII_      Oh, the Polish participated in the Holocaust too. They were not just innocent bystandards while the Germans did everything: Hitler didn't have that much free time and extra hands and feet. Same thing with Croatians during the Ustashe, which is why I'm not holding my breath for the canonization of Bl. Aloysius Stepinac. This is also why I don't exactly admire Polish nationalist saints like John Paul II, and it makes me wonder whether the Vatican hands out halos too eagerly.      Of course, there were many Croats and Poles who resisted the Holocaust, and are included among the Righteous Among the Nations in the Yad va Shem Holocaust Museum in Israel.",death caused nazi soviet wwii oh polish participated holocaust innocent bystandards german everything hitler much free time extra hand foot thing croatian ustashe holding breath canonization bl aloysius stepinac also exactly admire polish nationalist saint like john paul ii make wonder whether vatican hand halo eagerly course many croat pole resisted holocaust included among righteous among nation yad va shem holocaust museum israel,,718,1
52,"I would agree with John above that Kant wasn't motivated by a desire to undermine (Christian) theology, though he didn't help either.      Hume has launched an attack on metaphysics, in particular, moral philosophy and theology. I suspect Kant’s response to Hume was an act of self-defence, or to borrow his own word in the _Prolegomena to Any Future Metaphysics_ , a “rescue” mission. In a rescue mission, one is forced to rescue what he cares about the most, and forgo the rest. Kant made a vigorous attempt to defend moral philosophy, but left theology to fend for itself, if not threw it under the bus.",would agree john kant motivated desire undermine christian theology though help either hume launched attack metaphysics particular moral philosophy theology suspect response hume act self-defence borrow word prolegomenon future metaphysics “ rescue ” mission rescue mission one forced rescue care forgo rest kant made vigorous attempt defend moral philosophy left theology fend threw bus,,606,1
56,"Kant seems to consider that phenomena has a lower degree of existence than the thing-itself while considering phenomena real, so it will depend on the view that one takes on the relation between the two.      If we take a two-worlds interpretation them i suppose that both phenomena and noumena ""are"" but on diferent ways, so we need something like analogy. If we take a two-aspects interpretation them it seems like they are just one thing, so there is only a mode of existence. If we take something like S. Gardner view, that we dont know the relation at all, them who knows.",kant seems consider phenomenon lower degree existence thing-itself considering phenomenon real depend view one take relation two take two-worlds interpretation suppose phenomenon noumenon diferent way need something like analogy take two-aspects interpretation seems like one thing mode existence take something like gardner view dont know relation know,,577,1
79,"Isn't that what affirmative action effectively already does to some extent, which, incidentally, is on the chopping block? Except here, no rich people need to shave any money off their bank accounts. And hasn't it failed? And wasn't it just a lazy way of pretending to solve what is essentially a cultural problem? (Recent African immigrants, by contrast, do very well, academically and professionally, even after our previous American schools teach them that, despite what their lying eyes tell them, they are, in fact, oppressed, that there's no sense in denying it, and the only way out of the invisible cage is through rage and self-pity.)      But more to the point... By making things concrete, you make them tractable, and when you make them tractable, you make it possible to arrive at a goalpost. But who wants that? Once a problem is resolved, careers and institutions built around the problem are threatened because you've taken away their very raison d'etre. They no longer have the cudgel or leverage they once had.      The same is true of feminism. Many feminist demands have been met. But has feminism gone away? If anything, it's become even more radicalized. People often project their personal dissatisfactions and discomforts onto some external, broad ""common cause"". Doing so allows them to feel in control, like they've named the beast. Living a boring life? Must be because of racism. Not getting what you want? Must be because of sexism or misogyny. And once the demands of such people are met, they discover they're still where they were and this is infuriating. A rational person would take this as an opportunity for reflection, but a prideful person will simply double down. If things are still shabby, it's necessarily because we haven't gone far enough! Thus begins a race to the bottom...",isnt affirmative action effectively already extent incidentally chopping block except rich people need shave money bank account failed lazy way pretending solve essentially cultural problem recent african immigrant contrast well academically professionally even previous american school teach despite lying eye tell fact oppressed sense denying way invisible cage rage self-pity point making thing concrete make tractable make tractable make possible arrive goalpost want problem resolved career institution built around problem threatened taken away raison etre longer cudgel leverage true feminism many feminist demand met feminism gone away anything become even radicalized people often project personal dissatisfaction discomfort onto external broad common cause allows feel control like named beast living boring life must racism getting want must sexism misogyny demand people met discover still infuriating rational person would take opportunity reflection prideful person simply double thing still shabby necessarily gone far enough thus begin race bottom,,1819,1
83," _In the American context, how about totally free education (books, tuition, room and board, everything) at every level for historically oppressed minorities, paid for by the super-rich, and continued until such time as the wealth gap between whites and minorities was erased._      Amazing how so many plans to erase a racial divide (which must always be illicit and evil, not at all natural) inevitably turns into a not-so-subtle payday for people. There's a reason why ""free"" room and board, tuition, and education is paired with the requirement that it be ""paid for"" by someone else: because it's not free. And it's not going to be the super-rich paying either.      If the concern is to provide education as cheaply and freely as possible, maybe we should consider price caps on tuition. The fact is, with the modern internet, we are capable of providing a massive amount of education for dirt cheap compared to what traditional, outdated institutions currently offer. In fact, we already do so: see Coursera, or all kinds of other online options.      But this solution, while clearly viable and even superior to the traditional alternative, would not enrich the bloated, inefficient education system. And, for all the cries of racism and inequality, circumventing that kind of payout is not a price the loudest antiracists are willing to pay.      That's one of the real problems: at some point we have to be willing to ask whether the person crying ""racism!"" actually has a point, or if they're full of it. They often are. There's a real conversation that needs to be had.",american context totally free education book tuition room board everything every level historically oppressed minority paid super-rich continued time wealth gap white minority erased amazing many plan erase racial divide must always illicit evil natural inevitably turn not-so-subtle payday people reason free room board tuition education paired requirement paid someone else free going super-rich paying either concern provide education cheaply freely possible maybe consider price cap tuition fact modern internet capable providing massive amount education dirt cheap compared traditional outdated institution currently offer fact already see coursera kind online option solution clearly viable even superior traditional alternative would enrich bloated inefficient education system cry racism inequality circumventing kind payout price loudest antiracists willing pay one real problem point willing ask whether person cry racism actually point full often real conversation need,,1580,1
40,Also Gilson's Thomist Realism and The Critique of Knowledge and also Methodical Realism. The second one is good for beginners.,also thomist realism critique knowledge also methodical realism second one good beginner,,126,1
19,"All the same, precisely for that reason, Hume’s account of _philosophy_ , if not of common sense, is essentially destructive. Moreover, a consistent Humean will have to take a much more modest view of natural science than contemporary atheists are wont to do – in part because of Hume’s attack on attempts to justify induction, and in part because the deliverances of modern physics are hardly less abstruse and remote from common life than the rationalist speculations he was so keen to shoot down. A Humean must also give up a rationalistic ethics, given that, as he famously holds, there is nothing contrary to _reason_ (but only to the sentiments of the average person) to prefer that the entire world be destroyed than that one should suffer a scratch to his finger. Humean arguments entail a pessimism about the powers of human reason that doesn’t sit well with scientism or with dogmatic and triumphalist versions of atheism (even if many atheists and adherents of scientism naively suppose otherwise).",precisely reason account philosophy common sense essentially destructive moreover consistent humean take much modest view natural science contemporary atheist wont – part attack attempt justify induction part deliverance modern physic hardly le abstruse remote common life rationalist speculation keen shoot humean must also give rationalistic ethic given famously hold nothing contrary reason sentiment average person prefer entire world destroyed one suffer scratch finger humean argument entail pessimism power human reason sit well scientism dogmatic triumphalist version atheism even many atheist adherent scientism naively suppose otherwise,,1009,1
44,I heard once that there were some translations of some buddhist texts in Europe at his time. Funny to think how Hume reaction to they would be.,heard translation buddhist text europe time funny think hume reaction would,,143,1
107,"BERTAND RUSSELL: From a falsehood any statement can be derived.      HECKLER: Prove that if 2=1 then you are the Pope!      BERTRAND RUSSELL: The pope and I are two, therefore the Pope and I are one.",bertand russell falsehood statement derived heckler prove pope bertrand russell pope two therefore pope one,,199,1
81," _I've grown weary of abstract discussion of racial_      What defines ""race"". It has had different meanings at different times, and in different contexts.      _of racial issues_      Which issues? No, **specifically** which issues? Those of injustice? What about injustices commited by blacks at blacks? Oh, do you mean injusticed committed by blacks on whites? Shoot, reverse that, I mean by whites on blacks? What about all the other kinds of racial injustices?      _if we were serious about healing the racial divide_      What if only SOME of us are serious about it? Can we who are serious overcome the intent of those who don't want it changed? What about democracy?      _we'd be focused on specific, bold, plans_      I have a specific, bold plan: every white man marries a black woman, and every black man marries a white woman. In 2 generations, there will be no racial divide at all.      _how about totally free education_      Mere ""education"" doesn't do it, if (a) the recipient isn't willing or able to **receive** it. (Free) public high schools have enormous drop-out rates in some areas, (mostly by minorities but not solely) - they theoretically have a free education in front of them, but they decline it. If you re-make _college_ education to meet the standards of public schools, you'll get the same result.      _Specific, bold, measurable plan of action with a defined vision of success._      If you want to define success in such a narrow way, you guarantee failure in respect of _other kinds_ of success. But aside from that: if your attempt were to meet with ANTI-success (say, increased income gap), would you then **re- pay** the people you took the money from to pay for that effort? (Because, after all, it would have been demonstrated to be unjust.) And...whose money would you use to do that?      If you want to state a measurable outcome as ""success"", then you have to equally identify what constitutes a ""failure"" of the attempt. And you have to account for the _implications_ of failure, social and otherwise. Which means: ""free"" might not, actually, be free.",grown weary abstract discussion racial defines race different meaning different time different context racial issue issue specifically issue injustice injustice commited black black oh mean injusticed committed black white shoot reverse mean white black kind racial injustice serious healing racial divide u serious serious overcome intent want changed democracy focused specific bold plan specific bold plan every white man marries black woman every black man marries white woman generation racial divide totally free education mere education recipient willing able receive free public high school enormous drop-out rate area mostly minority solely - theoretically free education front decline re-make college education meet standard public school get result specific bold measurable plan action defined vision success want define success narrow way guarantee failure respect kind success aside attempt meet anti-success say increased income gap would re- pay people took money pay effort would demonstrated unjust andwhose money would use want state measurable outcome success equally identify constitutes failure attempt account implication failure social otherwise mean free might actually free,,2099,1
102,"""Oh, the Polish participated in the Holocaust too.""      One word: Kapo.",oh polish participated holocaust one word kapo,,72,1
24,"_Now… that which is in no respect defective, that which is in every way sufficient as a condition, seems to be precisely the being to which absolute necessity can fittingly be described. For while it contains the conditions of all that is possible, it itself does not require and indeed does not allow of any condition, and therefore satisfies… the concept of unconditioned necessity_…",now… respect defective every way sufficient condition seems precisely absolute necessity fittingly described contains condition possible require indeed allow condition therefore satisfies… concept unconditioned necessity…,,385,1
106,"When based on a lie, a sound reasoning can be used to reach any conclusion, true or otherwise.      Small example: is the statement ""if 1=2 then 37=-1"" true or false? It is actually true and simple to demonstrate using some arithmetic rules:   Step 1: 1=2 (deduct 1 from both sides)   Step 2: 0=1 (multiply both sides by 38)   Step 3: 0=38 (deduct 1 from both sides)   Step 4: -1=37 q.e.d.      In short, ""if A then B"" is always true if A is false. All you need to do is to convince someone that A is actually true so that with sound reasoning you may conclude any consequence B at your convenience.",based lie sound reasoning used reach conclusion true otherwise small example statement - true false actually true simple demonstrate using arithmetic rule step deduct side step multiply side step deduct side step - qed short b always true false need convince someone actually true sound reasoning may conclude consequence b convenience,,599,1
26,"_Such, then, is the natural procedure of human reason_.  _It… looks around for the concept of that which is independent of any condition, and finds it in that which is itself the sufficient condition of all else, that is, in that which contains all reality. But that which is all-containing and without limits is absolute unity, and involves the concept of a single being that is likewise the supreme being_. (pp. 495-97, Norman Kemp Smith translation)",natural procedure human reason it… look around concept independent condition find sufficient condition else contains reality all-containing without limit absolute unity involves concept single likewise supreme pp - norman kemp smith translation,,452,1
58,There are Kantian atheists. A Kantian atheist could accept his general metaphysical system while discarding his views on natural theology just like he could accept Kant's position on mathematics while judging him to have erred with regards to holding Euclidean geometry as logically necessary.,kantian atheist kantian atheist could accept general metaphysical system discarding view natural theology like could accept position mathematics judging erred regard holding euclidean geometry logically necessary,,293,1
82,"Lets ignore the broad discussion for a bit.      @First Anon      ""But more importantly, that would be pure consequentialism. It would be the sin of racism to favor particular groups of people on the basis of race alone.""      Okay, this does not work. Phil is not proposing this idea because he happens to like minorities. He is proposing it because these folks are on a quite crappy situation when compared to white folks. I understand that a group facing inferior living conditions, oportunities etc by injust factors that we can solve is a injustice that should be tackled in order to the common good of the place to be better realized.      Notice that i'am not discussing if the plan would work or what causes the inequalities, not my turf, only the claim that helping out a particular race as a matter of public police is necessarily racist.  ",let ignore broad discussion bit first anon importantly would pure consequentialism would sin racism favor particular group people basis race alone okay work phil proposing idea happens like minority proposing folk quite crappy situation compared white folk understand group facing inferior living condition oportunities etc injust factor solve injustice tackled order common good place better realized notice discussing plan would work cause inequality turf claim helping particular race matter public police necessarily racist,,850,1
9,"In 2018, the Belgians beat the Brazilians 2-1 in the 2018 World Cup soccer quarterfinals. There are about 18 times as many Brazilians and Belgians in the world. This raises a number of puzzles in value theory, if for simplicity we ignore everyone but Belgians and Brazilians in the world.",belgian beat brazilian - world cup soccer quarterfinal time many brazilian belgian world raise number puzzle value theory simplicity ignore everyone belgian brazilian world,,288,1
28,"The trouble with this sort of reasoning, Kant thinks, is not that its conclusion is false – again, he was no atheist – but rather that, given his epistemology, reason lacks the resources to transcend the empirical world and prove the existence of a necessary or unconditioned being outside it. The notion of causality, he argues, applies only _within_ the phenomenal world, the world of things as they appear to us, whereas reasoning to a necessary being would require applying it beyond that world, to the noumenal world or things as they are in themselves. And we cannot, in his view, know the latter.",trouble sort reasoning kant think conclusion false – atheist – rather given epistemology reason lack resource transcend empirical world prove existence necessary unconditioned outside notion causality argues applies within phenomenal world world thing appear u whereas reasoning necessary would require applying beyond world noumenal world thing view know latter,,603,1
39,"Try Etienne Gilson's The Unity of Philosophical Experience, which includes a penetrating analysis of modern philosophy, including Kant, from a Thomist perspective",try etienne unity philosophical experience includes penetrating analysis modern philosophy including kant thomist perspective,,162,1
42,That Hume could be so confident that he would cease to be is quite funny with his view on casuality XD,hume could confident would cease quite funny view casuality xd,,102,1
64,"@WCB      Its been a while since i read The Laws, but in there Plato argues for:      \- the existence of gods, with his cosmological argument that leads to the existence of souls   \- self movers - that started all other movement.      \- That the gods care about us, by pointing out that a better caretaker cares about the details of his works, so the gods do care about everything.      If these arguments come before Book X, i dont remember, them the Good Workman Argument does sound reasonable to one who accept these premises. Like Kant moral argument, hard to dismiss if you agree with the initial premises, it is just that atheists do not.      About the problem of evil, i dont remember Plato adressing it at all*, but he believed that:      \- the soul is living in a innatural condition when stuck in the body      \- that the soul is only happy when it goes to the intellectual goods, which every soul has the potential to do.      \- that after death the soul just goes eventually to another body      It seems that these premises do help developing a response to the problem of evil. Proclus,probably the best neoplatonist, did make a interesting little book on it, worth a reading.      *makes sense that the hebrews would know it(see the Torah and Job) before him, the gods that the atheists/agnostics of his time were discussing were the greek ones, so it would not come from they, and Plato was not only a elitist but also probably a ascetic, hardly the guy to care about lower people not having material goods",wcb since read law plato argues - existence god cosmological argument lead existence soul - self mover - started movement - god care u pointing better caretaker care detail work god care everything argument come book x dont remember good workman argument sound reasonable one accept premise like kant moral argument hard dismiss agree initial premise atheist problem evil dont remember plato adressing believed - soul living innatural condition stuck body - soul happy go intellectual good every soul potential - death soul go eventually another body seems premise help developing response problem evil proclusprobably best neoplatonist make interesting little book worth reading make sense hebrew would know itsee torah job god atheistsagnostics time discussing greek one would come plato elitist also probably ascetic hardly guy care lower people material good,,1528,1
